first_name,last_name,url,id,text,arg,Occupation score,Occupation score adjusted,Colby score,constituent_id
Jessica,Stanton,['https://www.kgw.com/article/news/politics/anti-abortion-rally-at-the-oregon-state-capitol-held-saturday/283-583013561'],b'7251',"['Portland Weather Summary: 53 degrees More than a dozen Oregonians attended a Justice 4 Life rally at the Oregon State Capitol Saturday in support of President Donald Trump\'s Supreme Court nominee Brett Kavanaugh. The rally in Salem was part of a series of rallies around the country hosted by Students for Life of America, a youth organization dedicated to abolishing abortion in their lifetime. The organization, which considers themselves a ""post-Roe organization,"" also provides education on abortion and promotes student leadership at a local and national level. Rallies around the nation were either organized by a regional coordinator or student leaders. Nichole Bentz, the Pacific Northwest regional coordinator for Students for Life of America and Salem rally organizer, said the purpose of Saturday\'s event was to show Oregon Senators Ron Wyden (D) and Jeff Merkley (D) that there is support for Kavanaugh in the state. ""We\'re organizing this rallies to call Judge Kavanaugh to be confirmed because he is a solid court nominee,"" Bentz, 24 of Corvallis, said. ""He has a strong record on religious liberty, free speech and protecting the pre-born."" Kavanaugh is President Trump\'s second Supreme Court nominee, following Justice Neil Gorsuch who was confirmed in 2017. Kavanaugh\'s confirmation could change the direction of the court to a more conservative side for decades. Bentz spoke at the rally, along with Jessica Stanton, a public affairs official from Oregon Right to Life, and Marcos Sanchez, a student leader for Students for Life of America. ""After Justice Neil Gorsuch was placed on the Supreme Court, we could only dream of another opportunity to have such major influence for the pro-life movement,"" Stanton said. ""We must show our support and raise our voices for our U.S. Senators to confirm the nomination of Brett Kavanaugh."" Abby Luschei can be reached at aluschei@statesmanjournal.com or 503-399-6747. Follow her on Twitter @abbyluschei or facebook.com/luscheiabby.']",0.0,1.0,0.058823529411764705,0.0,1023719
Michael,Gordon,"['http://www.dailymail.co.uk/wires/aap/article-6052075/Snapshot-round-22-NRL.html', 'https://www.dailytelegraph.com.au/sport/nrl/supercoach-news/nrl-casualty-ward-round-22/news-story/8aefcab5356d4488930b9cff6a7d28de']",b'7250',"['By Australian Associated Press Published: 05:23 EDT, 12 August 2018 | Updated: 05:23 EDT, 12 August 2018 * Quote of the Round: ""I respect all the people and supporters involved with this club and I intend to honour this contract."" - Wests Tigers coach Ivan Cleary vows to stick with the joint venture after being linked with a move to Penrith. * Man of the Round: Valentine Holmes starred in the Cronulla\'s stirring 17-14 win over Melbourne, scoring one try, saving another two and running 139 metres as he upstaged the greatest ever No.1 - Billy Slater. * Stat that Matters: After crossing for his first hat-trick since 2013, Jarryd Hayne moved past Brett Kenny to be second on Parramatta\'s all-time leading try-scoring list with 112 tries, only behind Luke Burt (124). * Magic Moment: After his family was the centre of back page news all week, Penrith halfback Nathan Cleary nailed a golden point field goal to seal his side\'s come-from-behind win over the Gold Coast. * Talking Point: With Anthony Griffin axed, Ivan Cleary affirming his loyalty to the Tigers, Trent Barrett threatening to quit Manly, and Wayne Bennett and Paul McGregor on shaky ground, you get the feeling the coaching merry-go-round is about to go into overdrive. * Judiciary Watch: Melbourne - Nelson Asofa-Solomona (cannonball tackle); North Queensland - Jason Taumalolo (shoulder charge); Penrith - Jack Hetherington (high tackle). * Casualty Ward: Melbourne - Ryan Hoffman (hamstring); Cronulla - Wade Graham (knee); St George Illawarra - Gareth Widdop (shoulder); Panthers - James Maloney (knee), James Tamou (leg); South Sydney - Alex Johnston (hamstring); Gold Coast - Michael Gordon (wrist dislocation), Brenko Lee (hamstring); Parramatta - Tim Mannah (broken hand); Canberra - Aidan Sezer (hamstring); Warriors - Leivaha Pulu (foot). * Under Pressure: St George Illawarra have lost five of their last six and are showing signs of imploding late in the year, as they have done in two of the previous three seasons. Sorry we are not currently accepting comments on this article. Published by Associated Newspapers Ltd Part of the Daily Mail, The Mail on Sunday & Metro Media Group', 'To use this website, cookies must be enabled in your browser. To enable cookies, follow the instructions for your browser below. Facebook App: Open links in External Browser There is a specific issue with the Facebook in-app browser intermittently making requests to websites without cookies that had previously been set. This appears to be a defect in the browser which should be addressed soon. The simplest approach to avoid this problem is to continue to use the Facebook app but not use the in-app browser. This can be done through the following steps: Enabling Cookies in Internet Explorer 7, 8 & 9 Enabling Cookies in Firefox Enabling Cookies in Google Chrome Enabling Cookies in Mobile Safari (iPhone, iPad) If you need to get in touch with us, please use the contact details below: Home Delivery customer enquiries Phone: 1800 022 552 Email: customerservice@nationwidenews.com.au Reader feedback and comments Email: news@dailytelegraph.com.au Switchboard T: (02) 9288 3000 Advertising enquiries T: (02) 9288 3507 View The Advertiser View The Herald Sun View The Courier Mail View Perth Now View The Australian View News.com.au A NOTE ABOUT RELEVANT ADVERTISING: We collect information about the content (including ads) you use across this site and use it to make both advertising and content more relevant to you on our network and other sites. This is also known as Online Behavioural Advertising. You can find out more about our policy and your choices, including how to opt-out here.']",0.0,0.0,0.0,0.0,1011876
Sara,Burns,"['https://www.theglobeandmail.com/canada/article-fredericton-nb-constable-killed-in-shooting-would-treat-everybody/', 'https://globalnews.ca/video/4381621/fredericton-police-release-names-of-2-officers-killed-in-shooting', 'https://www.thestar.com/news/canada/2018/08/10/at-least-four-dead-after-shooting-in-fredericton.html']",b'7249',"['The subject who is truly loyal to the Chief Magistrate will neither advise nor submit to arbitrary measures. Const. Sara Burns, 43, is shown in this undated police handout photo. HO/The Canadian Press In the middle of raising three boys, Sara Burns decided to go back to school and chase her dream of becoming a police officer. At 35, the Fredericton native decided to get a criminology degree, and then leave her husband and sons for six months of intensive training at the Atlantic Police Academy in Prince Edward Island. The driven recruit arrived in 2015 with a maturity that was uncommon among her 60 or so peers – most of whom were about 21 years old – and she was soon named the leader of the cohort for that year, according to Edgar MacLeod, who retired in January as the academy’s long-time executive director. Story continues below advertisement In an interview at the time with the Journal Pioneer, a local PEI newspaper, Ms. Burns explained her reasoning for joining law enforcement. “[Policing] is something that I think challenges you physically, mentally and socially; you need to be aware of those components. It’s a really challenging field and to survive you need to keep all of those in check,” she said. “To do well, you obviously need to maintain a certain standard, and here at the school they provide a lot of the theory and the skill to do that.” Mr. McLeod, a former president of the Canadian Association of Chiefs of Police, remembered her as physically capable and in possession of all the skills needed to enforce the law in dangerous situations. “But, beyond that, we also want to train our police officers to be compassionate and understanding of people, be patient with people – that sort of thing – and boy, she had that part down in spades,"" he said. “You could tell she would treat everybody with respect, not a showboat, she didn’t have an edge.” On Friday, friends and colleagues mourned Constable Burns after she and a fellow officer were killed in a quiet residential neighbourhood of Fredericton. Two civilians were also killed and a 48-year-old local man was in police custody on Friday evening with serious injuries. In 2016, soon after graduating from the academy, Constable Burns was hired by her hometown force, of which she had been an auxiliary member. Story continues below advertisement Story continues below advertisement Earlier this year, Constable Burns narrowly missed being struck by a knife that was thrown out the window by a man at the scene of a domestic incident, Fredericton news outlet The Daily Gleaner reported. With reports from Mike Hager, Andrea Woo, Vjosa Isai, Sunny Dhillon and the Canadian Press We have closed comments on this story for legal reasons or for abuse. For more information on our commenting policies and how our community-based moderation works, please read our Community Guidelines and our Terms and Conditions. Complimentary to subscribers Complimentary to subscribers Complimentary to subscribers Complimentary to subscribers Complimentary to subscribers Complimentary to subscribers © Copyright 2018 The Globe and Mail Inc. All rights reserved. 351 King Street East, Suite 1600, Toronto, ON Canada, M5A 0N1 Phillip Crawley, Publisher', 'Change Location Newscasts & Videos Fredericton Police Chief Leanne Fitch released the identities of two officers, 45-year-old Lawrence Robert Costello, 43-year-old Sara Burns, who were among four people shot and killed outside an apartment building on Friday morning.', 'This copy is for your personal non-commercial use only. To order presentation-ready copies of Toronto Star content for distribution to colleagues, clients or customers, or inquire about permissions/licensing, please go to: www.TorontoStarReprints.com A Fredericton man is facing four charges of first-degree murder after a shooting in Fredericton, N.B. on Friday. Matthew Vincent Raymond, 48, was charged Saturday morning with the deaths of two Fredericton police officers and two civilians, according to a news release from Fredericton police. The officers, identified Friday, are Const. Sara Burns, 43, and Const. Robb Costello, 45. Police confirmed the identity of the other two victims Saturday morning: Donald Robichaud, 42, and Bobbie Lee Wright, 32. Robichaud and Wright were in a new relationship, according to his cousin, Sean Callahan. He said they had just gotten together at the beginning of August. Callahan said there was “nothing bad you can say about” Robichaud. “When I got a message yesterday asking me if Donnie got shot, I was like, who in the hell would want to shoot Donnie Robichaud?” he told the Star in an interview. Callahan said he joined Robichaud’s mother and other family members at Dr. Everett Chalmers Regional Hospital on Friday morning. An RCMP officer confirmed with them around 6 p.m. that Robichaud was one of the victims, Callahan said. Robichaud, a father of three, lived alone on Brookside Dr., according to his cousin. The shooting occurred at that address around 7 a.m. Friday. Just 12 hours after a shooting that shocked the city of Fredericton, more than 100 people packed into a local church Friday night to mourn the victims. St. John the Evangelist Anglican Church is less than a kilometre away from the site of the shooting. Citizens of the small New Brunswick city gathered to sing hymns, sit in silent prayer and light candles. “I’m so sad,” said Mei Yong, who brought her 2-year-old son, Nova Lin, to the vigil. Yong said she was there to show her support to Fredericton police, who helped her in a time of personal need. Even though she didn’t know the two officers who were killed, she said she was grieving with those who did. Costello, 45, had served for 20 years with Fredericton police. “He loved being a police officer and he lived for being a police officer,” his common-law partner, Jackie McLean said. “He is the only police officer who I have ever known who could write someone a ticket and have the person thank them after.” Burns, 43, was with Fredericton police for the past two years as an officer, and two years before that as an auxiliary officer. Fredericton is a city of less than 60,000, and its residents are tightly connected. One of those residents, retired United Church minister Brian DeLong, began getting calls just after 4 p.m. Police had just released the names of the officers — the first to respond to the call — who had been fatally shot, and people were badly rattled by the news. One of the victims, Const. Burns, was the daughter-in-law of two members of his congregation. “People from my congregation called me and said, ‘Did you know?’ ” DeLong said before the vigil. He rushed to join the vigil at St. John the Evangelist, where he read a scripture in dedication to Burns’ family, and all those grieving. The vigil was open to the whole community, its doors propped open to let in the evening breeze as the sun began to set. Fans moved the air around in the small gym where people gathered, but it remained hot after another stifling summer day. Read more: Two officers identified in New Brunswick shooting A timeline of the deadly shooting in Fredericton Fredericton shootings are fresh trauma for N.B., four years after Moncton attack After the vigil, some made their way toward the scene of the shooting. Several blocks around the site of the shooting remained blocked off by police and New Brunswick RCMP on Friday evening, with several officers and a forensic investigation vehicle parked outside a four-building apartment complex at 237 Brookside Dr. Apparent bullet holes were visible in a second-storey window of one of the buildings at the complex. “It’s unbelievable in Fredericton,” Yong said. “It’s safe here, it’s not Toronto, so I just can’t believe it.” With files from The Canadian Press Taryn Grant is a reporter for StarMetro Halifax. Follow her on Twitter: @tarynalgrant Copyright owned or licensed by Toronto Star Newspapers Limited. All rights reserved. Republication or distribution of this content is expressly prohibited without the prior written consent of Toronto Star Newspapers Limited and/or its licensors. To order copies of Toronto Star articles, please go to: www.TorontoStarReprints.com Callahan said there was “nothing bad you can say about” Robichaud. “When I got a message yesterday asking me if Donnie got shot, I was like, who in the hell would want to shoot Donnie Robichaud?” he told the Star in an interview. Callahan said he joined Robichaud’s mother and other family members at Dr. Everett Chalmers Regional Hospital on Friday morning. An RCMP officer confirmed with them around 6 p.m. that Robichaud was one of the victims, Callahan said. Robichaud, a father of three, lived alone on Brookside Dr., according to his cousin. The shooting occurred at that address around 7 a.m. Friday. Just 12 hours after a shooting that shocked the city of Fredericton, more than 100 people packed into a local church Friday night to mourn the victims. St. John the Evangelist Anglican Church is less than a kilometre away from the site of the shooting. Citizens of the small New Brunswick city gathered to sing hymns, sit in silent prayer and light candles. “I’m so sad,” said Mei Yong, who brought her 2-year-old son, Nova Lin, to the vigil. Yong said she was there to show her support to Fredericton police, who helped her in a time of personal need. Even though she didn’t know the two officers who were killed, she said she was grieving with those who did. Costello, 45, had served for 20 years with Fredericton police. “He loved being a police officer and he lived for being a police officer,” his common-law partner, Jackie McLean said. “He is the only police officer who I have ever known who could write someone a ticket and have the person thank them after.” Burns, 43, was with Fredericton police for the past two years as an officer, and two years before that as an auxiliary officer. Fredericton is a city of less than 60,000, and its residents are tightly connected. One of those residents, retired United Church minister Brian DeLong, began getting calls just after 4 p.m. Police had just released the names of the officers — the first to respond to the call — who had been fatally shot, and people were badly rattled by the news. One of the victims, Const. Burns, was the daughter-in-law of two members of his congregation. “People from my congregation called me and said, ‘Did you know?’ ” DeLong said before the vigil. He rushed to join the vigil at St. John the Evangelist, where he read a scripture in dedication to Burns’ family, and all those grieving. The vigil was open to the whole community, its doors propped open to let in the evening breeze as the sun began to set. Fans moved the air around in the small gym where people gathered, but it remained hot after another stifling summer day. Read more: Two officers identified in New Brunswick shooting A timeline of the deadly shooting in Fredericton Fredericton shootings are fresh trauma for N.B., four years after Moncton attack After the vigil, some made their way toward the scene of the shooting. Several blocks around the site of the shooting remained blocked off by police and New Brunswick RCMP on Friday evening, with several officers and a forensic investigation vehicle parked outside a four-building apartment complex at 237 Brookside Dr. Apparent bullet holes were visible in a second-storey window of one of the buildings at the complex. “It’s unbelievable in Fredericton,” Yong said. “It’s safe here, it’s not Toronto, so I just can’t believe it.” With files from The Canadian Press Taryn Grant is a reporter for StarMetro Halifax. Follow her on Twitter: @tarynalgrant']",0.0,1.3333333333333333,0.07017543859649122,0.0,1017395
Michael,Gordon,"['https://www.islandpacket.com/sports/nfl/article217070340.html', 'https://www.goldcoastbulletin.com.au/sport/nrl/the-bulletin-picks-a-top-13-team-of-current-nrl-players-from-the-northern-rivers/news-story/05fb682b20154a58ffff8d397171d27c']",b'7248',"[""By Michael Gordon mgordon@charlotteobserver.com August 21, 2018 11:51 AM Carolina Panthers rookie receiver D.J. Moore faces an Oct. 2 court date after being cited on Interstate 77 earlier this month for doing 113 mph in a 65 mph work zone. “F---- that car is moving,” Trooper H.L. Bautista wrote in his report of the stop, which occurred after Moore and his teammates returned to the city after a preseason game against the Buffalo Bills in New York. Moore, 21, was charged with speeding, and speeding in a work zone at over 80 mph. He was pulled over at 2:52 a.m. on I-77 north near the intersection of N.C. 24, according to Bautista’s report. No one covers what is happening in our community better than we do. And with a digital subscription, you'll never miss a local story. The trooper said Moore’s 2017 white Mercedes came up on him from behind and that Bautista followed Moore’s car for about a mile before pulling him over. The trooper described traffic conditions at the time as “light.” In his report, Bautista described Moore as “polite and cooperative,” and that the player told him the team had just landed at Charlotte-Douglas International Airport and of him “wanting to get home.” According to the address included on the trooper’s report, Moore lives near the intersection of I-485 and Prosperity Church Road, east of Northlake Mall. “When it all happened, D.J. came to us right away and explained the situation. He was very remorseful. He understood,” said Panthers coach Ron Rivera. “We chastised him obviously. And he’s moving on. And it’s an opportunity to learn for him and for the other young guys. ‘Hey, you have a responsibility to the community.’” Hours earlier, Moore played an instrumental role in the Panthers’ 28-23 win over Buffalo. The rookie from Maryland was the team’s leading receiver, catching four passes for 75 yards. Reporter Jourdan Rodrigue contributed to this story. Panthers newest wide receiver D.J. Moore talks about being drafted in the first round by the Panthers, his playing style, talking with Cam Newton, being complimented by Steve Smith Sr. and what D.J. stand for. View More Video We've got you covered if you're looking for box scores and other late sports results that missed the printed newspaper because of early deadlines. Our Sports Extra pages are formatted like traditional printed sports results, and are available in our e-Edition print-replica newspapers. To find the Sports Extra: Open either The Island Packet or The Beaufort Gazette e-Edition (free to print and digital subscribers) and look for the Sports Extra icon () in the top menu. If you're using an iPhone or other smartphone, or an iPad in portrait view, you'll find the Sports Extra pages in the menu at the upper right (look for the symbol). Real-time updates and all local stories you want right in the palm of your hand."", 'To use this website, cookies must be enabled in your browser. To enable cookies, follow the instructions for your browser below. Facebook App: Open links in External Browser There is a specific issue with the Facebook in-app browser intermittently making requests to websites without cookies that had previously been set. This appears to be a defect in the browser which should be addressed soon. The simplest approach to avoid this problem is to continue to use the Facebook app but not use the in-app browser. This can be done through the following steps: Enabling Cookies in Internet Explorer 7, 8 & 9 Enabling Cookies in Firefox Enabling Cookies in Google Chrome Enabling Cookies in Mobile Safari (iPhone, iPad) View The Herald Sun View The Advertiser View The Daily Telegraph View The Courier Mail View Perth Now View News.com.au A NOTE ABOUT RELEVANT ADVERTISING: We collect information about the content (including ads) you use across this site and use it to make both advertising and content more relevant to you on our network and other sites. This is also known as Online Behavioural Advertising. You can find out more about our policy and your choices, including how to opt-out here.']",0.0,0.0,0.0,0.0,1011876
